{
  "schemaVersion": "hadara.releaseArtifact.manifest.v1",
  "package": {
    "name": "hadara",
    "version": "0.5.0-rc.2",
    "private": false,
    "license": "MIT",
    "description": "Local-first evidence control plane for trustworthy agentic development, resumable task capsules, and guarded handoffs.",
    "keywords": [
      "ai",
      "agent",
      "agents",
      "coding-agent",
      "developer-tools",
      "cli",
      "workflow",
      "automation",
      "task-management",
      "evidence",
      "handoff",
      "mcp",
      "hadara"
    ],
    "repository": {
      "type": "git",
      "url": "git+https://github.com/ictseoyoungmin/HADARA.git"
    },
    "homepage": "https://github.com/ictseoyoungmin/HADARA#readme",
    "bugs": {
      "url": "https://github.com/ictseoyoungmin/HADARA/issues"
    }
  },
  "tarball": {
    "fileName": "hadara-0.5.0-rc.2.tgz",
    "hash": "sha256:a6a96c6ada134db087954553ca2076eb085181369dc8b897f9c4ffc9385128e5"
  },
  "files": [
    {
      "path": "LICENSE",
      "byteLength": 1070
    },
    {
      "path": "README.md",
      "byteLength": 15817
    },
    {
      "path": "dist/agent/evidence.js",
      "byteLength": 1950
    },
    {
      "path": "dist/agent/loop.js",
      "byteLength": 4301
    },
    {
      "path": "dist/cli/actor.js",
      "byteLength": 927
    },
    {
      "path": "dist/cli/args.js",
      "byteLength": 4304
    },
    {
      "path": "dist/cli/commands.js",
      "byteLength": 1349
    },
    {
      "path": "dist/cli/context.js",
      "byteLength": 3217
    },
    {
      "path": "dist/cli/docs.js",
      "byteLength": 13579
    },
    {
      "path": "dist/cli/doctor.js",
      "byteLength": 6552
    },
    {
      "path": "dist/cli/errors.js",
      "byteLength": 2219
    },
    {
      "path": "dist/cli/evidence-json.js",
      "byteLength": 3469
    },
    {
      "path": "dist/cli/evidence.js",
      "byteLength": 14970
    },
    {
      "path": "dist/cli/harness.js",
      "byteLength": 1754
    },
    {
      "path": "dist/cli/help.js",
      "byteLength": 7889
    },
    {
      "path": "dist/cli/hermes-json.js",
      "byteLength": 1208
    },
    {
      "path": "dist/cli/hermes.js",
      "byteLength": 1099
    },
    {
      "path": "dist/cli/init.js",
      "byteLength": 10805
    },
    {
      "path": "dist/cli/install.js",
      "byteLength": 1595
    },
    {
      "path": "dist/cli/legacy-boundary.js",
      "byteLength": 4414
    },
    {
      "path": "dist/cli/main.js",
      "byteLength": 9681
    },
    {
      "path": "dist/cli/mcp.js",
      "byteLength": 509
    },
    {
      "path": "dist/cli/policy-json.js",
      "byteLength": 875
    },
    {
      "path": "dist/cli/policy.js",
      "byteLength": 1207
    },
    {
      "path": "dist/cli/project-state.js",
      "byteLength": 1512
    },
    {
      "path": "dist/cli/protocol.js",
      "byteLength": 6231
    },
    {
      "path": "dist/cli/schema.js",
      "byteLength": 1467
    },
    {
      "path": "dist/cli/session.js",
      "byteLength": 1789
    },
    {
      "path": "dist/cli/slice.js",
      "byteLength": 3834
    },
    {
      "path": "dist/cli/status-json.js",
      "byteLength": 551
    },
    {
      "path": "dist/cli/status.js",
      "byteLength": 3215
    },
    {
      "path": "dist/cli/task-json.js",
      "byteLength": 683
    },
    {
      "path": "dist/cli/task.js",
      "byteLength": 18466
    },
    {
      "path": "dist/cli/tools.js",
      "byteLength": 1018
    },
    {
      "path": "dist/cli/tui.js",
      "byteLength": 3262
    },
    {
      "path": "dist/cli/validation.js",
      "byteLength": 6576
    },
    {
      "path": "dist/cli/version.js",
      "byteLength": 1359
    },
    {
      "path": "dist/context/code-graph-extractor.js",
      "byteLength": 4099
    },
    {
      "path": "dist/context/code-index.js",
      "byteLength": 49889
    },
    {
      "path": "dist/context/context-cache-store.js",
      "byteLength": 47784
    },
    {
      "path": "dist/context/context-graph-builder.js",
      "byteLength": 22872
    },
    {
      "path": "dist/context/context-graph.js",
      "byteLength": 1168
    },
    {
      "path": "dist/context/context-pack.js",
      "byteLength": 31570
    },
    {
      "path": "dist/context/context-slice-boundary.js",
      "byteLength": 1658
    },
    {
      "path": "dist/context/context-slice.js",
      "byteLength": 19264
    },
    {
      "path": "dist/context/document-extractors.js",
      "byteLength": 9271
    },
    {
      "path": "dist/context/evidence-extractors.js",
      "byteLength": 8882
    },
    {
      "path": "dist/context/extractor-contract.js",
      "byteLength": 7287
    },
    {
      "path": "dist/context/project-kind.js",
      "byteLength": 929
    },
    {
      "path": "dist/context/registry-extractors.js",
      "byteLength": 7934
    },
    {
      "path": "dist/context/release-extractors.js",
      "byteLength": 8313
    },
    {
      "path": "dist/context/session-start.js",
      "byteLength": 18089
    },
    {
      "path": "dist/context/source-manifest.js",
      "byteLength": 25418
    },
    {
      "path": "dist/context/state-projection.js",
      "byteLength": 9294
    },
    {
      "path": "dist/context/task-extractors.js",
      "byteLength": 8300
    },
    {
      "path": "dist/core/actor-context.js",
      "byteLength": 2635
    },
    {
      "path": "dist/core/audit.js",
      "byteLength": 1403
    },
    {
      "path": "dist/core/events.js",
      "byteLength": 2315
    },
    {
      "path": "dist/core/fs.js",
      "byteLength": 4787
    },
    {
      "path": "dist/core/invocation-fs-memo.js",
      "byteLength": 5505
    },
    {
      "path": "dist/core/local-time.js",
      "byteLength": 686
    },
    {
      "path": "dist/core/next-action.js",
      "byteLength": 484
    },
    {
      "path": "dist/core/paths.js",
      "byteLength": 3653
    },
    {
      "path": "dist/core/plan-context.js",
      "byteLength": 999
    },
    {
      "path": "dist/core/redaction.js",
      "byteLength": 6102
    },
    {
      "path": "dist/core/schema.js",
      "byteLength": 22005
    },
    {
      "path": "dist/core/timing.js",
      "byteLength": 404
    },
    {
      "path": "dist/core/workspace.js",
      "byteLength": 2137
    },
    {
      "path": "dist/evidence/evidence.js",
      "byteLength": 25900
    },
    {
      "path": "dist/evidence/normalizer.js",
      "byteLength": 7195
    },
    {
      "path": "dist/evidence/private-manifest.js",
      "byteLength": 4209
    },
    {
      "path": "dist/evidence/semantics.js",
      "byteLength": 13697
    },
    {
      "path": "dist/harness/validate.js",
      "byteLength": 74462
    },
    {
      "path": "dist/hermes/context-export.js",
      "byteLength": 5463
    },
    {
      "path": "dist/index.js",
      "byteLength": 1413
    },
    {
      "path": "dist/init/adoption.js",
      "byteLength": 35996
    },
    {
      "path": "dist/init/doctor.js",
      "byteLength": 13212
    },
    {
      "path": "dist/init/files.js",
      "byteLength": 2979
    },
    {
      "path": "dist/init/model.js",
      "byteLength": 19655
    },
    {
      "path": "dist/init/planner.js",
      "byteLength": 24886
    },
    {
      "path": "dist/init/profile.js",
      "byteLength": 3198
    },
    {
      "path": "dist/init/project.js",
      "byteLength": 2867
    },
    {
      "path": "dist/init/report.js",
      "byteLength": 550
    },
    {
      "path": "dist/init/safety.js",
      "byteLength": 5799
    },
    {
      "path": "dist/init/scaffold.js",
      "byteLength": 1896
    },
    {
      "path": "dist/init/templates.js",
      "byteLength": 54434
    },
    {
      "path": "dist/init/transaction.js",
      "byteLength": 21646
    },
    {
      "path": "dist/init/types.js",
      "byteLength": 77
    },
    {
      "path": "dist/init/upgrade.js",
      "byteLength": 13563
    },
    {
      "path": "dist/mcp/server.js",
      "byteLength": 5238
    },
    {
      "path": "dist/mcp/tool-dispatch.js",
      "byteLength": 6317
    },
    {
      "path": "dist/mcp/tool-registry.js",
      "byteLength": 6180
    },
    {
      "path": "dist/mcp/tool-schemas.js",
      "byteLength": 982
    },
    {
      "path": "dist/policy/command-risk.js",
      "byteLength": 1790
    },
    {
      "path": "dist/policy/permission-matrix.js",
      "byteLength": 2224
    },
    {
      "path": "dist/policy/policy.js",
      "byteLength": 1659
    },
    {
      "path": "dist/policy/preflight.js",
      "byteLength": 1457
    },
    {
      "path": "dist/policy/presets.js",
      "byteLength": 1620
    },
    {
      "path": "dist/policy/tokenizer.js",
      "byteLength": 1511
    },
    {
      "path": "dist/providers/fallback-executor.js",
      "byteLength": 1522
    },
    {
      "path": "dist/providers/mock-provider.js",
      "byteLength": 1640
    },
    {
      "path": "dist/providers/provider-contract.js",
      "byteLength": 77
    },
    {
      "path": "dist/providers/provider-preparation.js",
      "byteLength": 8950
    },
    {
      "path": "dist/providers/scripted-provider.js",
      "byteLength": 2557
    },
    {
      "path": "dist/schemas/active-run-projection.schema.json",
      "byteLength": 2965
    },
    {
      "path": "dist/schemas/active-run-resume.schema.json",
      "byteLength": 2753
    },
    {
      "path": "dist/schemas/actor-context.schema.json",
      "byteLength": 658
    },
    {
      "path": "dist/schemas/clean-checkout-smoke.schema.json",
      "byteLength": 5171
    },
    {
      "path": "dist/schemas/close-source.schema.json",
      "byteLength": 1504
    },
    {
      "path": "dist/schemas/code-index.schema.json",
      "byteLength": 7023
    },
    {
      "path": "dist/schemas/context-cache-record.schema.json",
      "byteLength": 1880
    },
    {
      "path": "dist/schemas/context-cache-status.schema.json",